{
  "schema_version": 1,
  "id": "hengdian-storyboard",
  "display_name": "虚构片场分镜簿",
  "description": "用铅笔电影分镜、场记板切片和局部华丽的布景水彩，表现假宫殿背后的真实劳动，以及造梦流水线正在面对的变化。",
  "base_mode": "ink-comic",
  "recommended_for": [
    "影视工业与幕后职业",
    "城市产业和流动人口",
    "真实劳动与虚构景观的反差",
    "技术冲击传统生产方式的故事"
  ],
  "style_overrides": {
    "styleLock": "电影导演分镜簿式的纪实手绘：主体由有力度的铅笔线、灰阶阴影和场景框格构成，宫殿布景局部覆以褪色朱红与哑金水彩，真实劳动者保留纸面和石墨触感；画面可见分镜框边、胶带和裁切痕迹，但所有符号必须是无文字的纯图形。华丽与粗粝始终在同一镜头内对照。",
    "compositionRule": "使用宽银幕分镜构图和明确景别变化：大全景建立假城市尺度，中景呈现多剧组并行，近景落在龙袍下摆的泥、盒饭、工具和疲惫面孔。允许用分镜框中框表现不同朝代同时拍摄，但同屏最多三个框格，并维持清楚的视觉阅读顺序。",
    "colorRule": "石墨黑#333436、纸张灰白#DDD9CE和片场蓝灰#66747B为基础；宫墙使用褪色朱红#A74437，龙袍与灯具只点缀哑金#B18A4E，工作服和道具暗部使用泥褐#655447；面向未来的不确定段落逐渐抽走暖色，收束到冷灰#879096。禁止霓虹赛博色和彩色古装偶像剧滤镜。",
    "isolationRule": "人物动作和职业道具必须清楚可辨，群演、摄影机、灯架、布景墙分别占据独立层次；不要让不同剧组服饰和肢体互相融合。框中框必须有稳定边缘且不切断关键面孔，空片场段落保留大面积负空间。",
    "scenePrompt": {
      "createLine": "创作一格电影分镜簿式的片场纪实画面，在同一宽银幕构图中并置华丽假景和具体劳动，让观众先看到造梦，再看到支撑梦的人。",
      "constraintsPrefix": "严格保持虚构片场分镜簿风格：宽银幕铅笔分镜、石墨灰阶、局部褪色朱红与哑金、纸面裁切和无字场记图形、清晰景别与真实幕后劳动；指定朝代服装道具、现代片场设备和建筑布景必须各自准确并明确属于拍摄现场。",
      "constraintsSuffix": "画面中不得生成任何文字、数字、场记板内容、片名、招牌、字幕、logo、水印或界面元素；历史角色与现代设备同框时必须明确为影视拍摄现场，不得误画成真实历史时代，不得混用错误朝代服饰；避免摄影写实、3D游戏渲染、流量古偶海报和无关赛博科技。"
    }
  },
  "episode_defaults": {
    "accent": "#A74437",
    "cover": {
      "background": "#DDD9CE",
      "accent": "#A74437",
      "dark_accent": "#333436"
    }
  },
  "editorial": {
    "aspect_ratio": "3:4",
    "target_duration_sec": 285,
    "target_narration_chars": [
      1050,
      1450
    ],
    "visual_motifs": [
      "十二位不同朝代的皇帝在同一片场吃盒饭",
      "华丽宫墙背后的木撑、灯架和电缆",
      "群演登记、候场、奔跑和收工的流水线",
      "分镜框外伸出的化妆刷、扳手和摄影机",
      "暖色逐渐退去的空布景与未被使用的宫门"
    ],
    "avoid": [
      "把群演生活拍成追梦鸡汤",
      "只展示宫殿而忽略幕后劳动",
      "不同朝代服装随意混搭且不交代片场语境",
      "把人工智能具象化成发光机器人",
      "使用文字场记板或片名卡解释章节"
    ],
    "motion_preferences": [
      "用分镜框推拉切换大全景、中景和物件特写",
      "横移穿过不同剧组，形成同地异朝的喜剧反差",
      "以场记板合拢的无字图形或黑场完成硬切",
      "结尾逐步降低帧内人物密度和暖色，停在空布景"
    ],
    "narration_tone": "冷静、有黑色幽默但不消费个体困境；把宏观产业账本落到盒饭、泥点和等待这些具体细节上。"
  }
}
