{
  "schema_version": 1,
  "id": "celadon-kiln-scroll",
  "display_name": "天青窑火长卷",
  "description": "把宋画长卷的留白、瓷器图谱的精确轮廓与窑火截面的物质感叠在一起：器物安静，时代暗流在背景中缓慢推进。",
  "base_mode": "essay",
  "recommended_for": [
    "器物史与工艺史",
    "审美观念的形成与流变",
    "以单件文物串联王朝兴衰的故事",
    "需要同时表现微观材质与宏观历史的文化主题"
  ],
  "style_overrides": {
    "styleLock": "北宋院体画式的克制构图与手绘长卷质感，纤细墨线勾勒器形，半透明矿物色层表现釉面，纸张纤维清晰但不过度做旧；人物小于器物和建筑，时代信息藏在远景，窑火是全片唯一强烈的暖色光源。画面必须像连续展开的同一轴长卷，保持统一笔触、尺度与光向。",
    "compositionRule": "以横向长卷的散点透视组织场景，主体器物置于画面三分线或大片留白边缘；微观特写可切入釉裂、支钉痕和窑炉截面，宏观段落用山水、城郭、汴河与窑址形成远中近三层。每个镜头只保留一个视觉主语，避免博物馆展柜式正面陈列。",
    "colorRule": "主色仅用宣纸米白#E8DFC9、天青#91AFB2、梅子青#738F83、淡墨#59615B与窑灰#9A8E7A；窑火和战争警讯才使用橙红#C65A32，亮部以月白#F3F0E6收束。全片低饱和，禁止现代霓虹色和高对比商业海报色。",
    "isolationRule": "人物、器物、窑炉、建筑均以完整清晰轮廓从纸面留白中分离，主体周围保留可呼吸的空域；不得出现边缘粘连、重复手脚、漂浮器物或无法辨认的纹样。需要展示工艺步骤时，每幅只呈现一个动作节点。",
    "scenePrompt": {
      "createLine": "创作一幅宋画长卷与瓷器工艺图谱融合的手绘叙事场景，让天青瓷器成为安静的视觉锚点，历史人物与窑火在同一纸本世界中推进故事。",
      "constraintsPrefix": "严格保持天青窑火长卷风格：低饱和矿物色、纤细墨线、宣纸纤维、散点透视、大面积留白、统一光向和连续长卷空间；准确表现指定朝代的服饰、建筑、器形、窑具与生产动作。",
      "constraintsSuffix": "画面中不得生成任何文字、数字、书法、印章内容、招牌、字幕、logo、水印或界面元素；不得出现摄影写实、3D塑料质感、现代服装与设备、欧式建筑、错误朝代器物等时代错置；不得堆叠无关装饰。"
    }
  },
  "episode_defaults": {
    "accent": "#91AFB2",
    "cover": {
      "background": "#E8DFC9",
      "accent": "#91AFB2",
      "dark_accent": "#394A46"
    }
  },
  "editorial": {
    "aspect_ratio": "3:4",
    "target_duration_sec": 330,
    "target_narration_chars": [
      1250,
      1650
    ],
    "visual_motifs": [
      "五枚支钉托起的天青釉洗",
      "釉面蟹爪纹逐渐化为河流与历史裂缝",
      "柴窑火焰映在匠人眼中",
      "茶盏、书案与文人衣袖形成静物组",
      "长卷尽头熄灭的窑口与散落瓷片"
    ],
    "avoid": [
      "把宋瓷画成明清青花瓷",
      "满屏宫廷人物抢走器物主线",
      "高饱和青绿色滤镜",
      "博物馆商品广告式旋转展示",
      "以文字标签解释工艺"
    ],
    "motion_preferences": [
      "沿长卷缓慢横移，段落切换像纸轴继续展开",
      "釉裂特写使用极慢推进，不做快速缩放",
      "以窑烟、茶汽和水纹承担柔和转场",
      "窑火段落允许一次短促加速，随后回归静止"
    ],
    "narration_tone": "冷静、含蓄而有物质触感，像懂工艺的讲述者在一件器物前慢慢揭开繁荣与脆弱。"
  }
}
