{
  "schema_version": 1,
  "id": "luxury-food-atlas",
  "display_name": "奢侈食物航线图鉴",
  "description": "用十九世纪铜版食物图鉴、旧航海地图和现代精品菜单的拼贴，追踪普通食物如何经过运输、改名与叙事被重新标价。",
  "base_mode": "essay",
  "recommended_for": [
    "食物社会史与消费史",
    "品牌、定价和身份建构",
    "跨国贸易与文化传播",
    "需要对比同一物品前后身价的商业故事"
  ],
  "style_overrides": {
    "styleLock": "复古食物图鉴、航运档案与菜单拼贴的统一纸本美术：食材以细密铜版线描和少量手工套色呈现，背景由旧地图轮廓、票据边缘、餐盘俯视图和航线虚线构成；奢侈感来自克制的构图与材质对比，不使用金碧辉煌的俗艳符号。跨时代场景共享同一标本册页面逻辑。",
    "compositionRule": "每幅以一种食材为中心标本，左侧或下方留出明显负空间；通过海岸、港口、冷链箱、餐桌和餐厅形成由产地到消费端的空间路径。价格变化以餐盘大小、人物距离、器皿材质和画面留白的变化表达，不在画面内使用价格数字或文字标签。",
    "colorRule": "底色为旧纸米黄#E4D3B2和油墨黑#2F302D，航线与档案层使用海图蓝#607D86、褪色砖红#A9513F和橄榄绿#6F7552；食材可使用龙虾珊瑚红#C75B45、三文鱼橙#DC8060与鱼子酱墨蓝#293A43作为局部鲜色，金属与高价餐具仅用哑金#B59355。禁止荧光色与大面积纯金。",
    "isolationRule": "主食材必须完整、可辨识且与背景档案层清楚分离；同屏配角不超过三类，人物只作为比例和阶层关系的剪影或半身叙事角色。拼贴边缘要有纸张裁切感但不得遮挡主体，不生成无法识别的食物混合物。",
    "scenePrompt": {
      "createLine": "创作一页复古食物航线图鉴，把指定食材、产地环境、运输路径和消费场景编排成克制的铜版画拼贴，用构图而非文字表现身价逆转。",
      "constraintsPrefix": "严格保持奢侈食物航线图鉴风格：旧纸、铜版线描、手工套色、地图与菜单档案拼贴、俯视餐盘和清晰的产地到餐桌路径；食材形态、捕捞加工方式、服饰器皿与故事发生年代必须准确。",
      "constraintsSuffix": "画面中不得生成任何文字、字母、数字、价签内容、菜单内容、品牌、logo、水印、字幕或界面元素；不得出现错误地域物种、现代设备闯入历史场景、跨时代餐具服装等时代错置；避免摄影写实、廉价美食广告、过度油亮和拥挤自助餐式构图。"
    }
  },
  "episode_defaults": {
    "accent": "#A9513F",
    "cover": {
      "background": "#E4D3B2",
      "accent": "#C75B45",
      "dark_accent": "#293A43"
    }
  },
  "editorial": {
    "aspect_ratio": "3:4",
    "target_duration_sec": 270,
    "target_narration_chars": [
      1000,
      1400
    ],
    "visual_motifs": [
      "从海岸堆积物到银盘主菜的龙虾",
      "横跨海洋的红色航线与冷链箱",
      "同一种食材在粗陶碗和精致餐盘中的对照",
      "餐桌逐渐变空、留白逐渐变多的身价变化",
      "食材标本旁不断更换的器皿和用餐者"
    ],
    "avoid": [
      "一次塞入过多食材导致主线分散",
      "直接用金币、钻石和皇冠表示昂贵",
      "不准确的食材形态或捕捞场景",
      "现代美食摄影式浅景深",
      "依赖画内价格与菜单文字讲故事"
    ],
    "motion_preferences": [
      "像翻阅标本册一样纵向或横向换页",
      "航线沿地图缓慢生长，连接产地与餐桌",
      "同一食材保持位置不变，器皿和环境做匹配切换",
      "用纸片滑入、图钉定位和油墨晕开完成转场"
    ],
    "narration_tone": "机敏、克制，带一点看穿消费幻术后的幽默；事实密度高，但不嘲讽普通人的选择。"
  }
}
